{
  "$schema": "https://json-schema.org/draft/2020-12/schema",
  "$id": "https://github.com/gatekeeper454/KIL/schemas/scenario-v1.schema.json",
  "$comment": "KTP citation: https://github.com/nmcitra/ktp-rfc/blob/main/CITATION.cff",
  "title": "KIL historical replay scenario v1",
  "type": "object",
  "additionalProperties": false,
  "required": ["schema_version", "scenario_id", "primary_source", "events"],
  "properties": {
    "schema_version": {"const": "kil.scenario.v1"},
    "scenario_id": {"type": "string", "minLength": 1},
    "primary_source": {"type": "string", "format": "uri", "minLength": 1},
    "events": {
      "type": "array",
      "minItems": 1,
      "items": {
        "type": "object",
        "additionalProperties": false,
        "required": [
          "event_id", "phase", "timestamp_s", "identity", "authority_class",
          "summary", "source_ref", "credential_valid", "policy_allows_action",
          "control_rationale", "state_rationale", "depends_on", "state",
          "modeled_context"
        ],
        "properties": {
          "event_id": {"type": "string", "minLength": 1},
          "phase": {"type": "integer", "minimum": 1},
          "timestamp_s": {"type": "integer", "minimum": 0},
          "identity": {"type": "string", "minLength": 1},
          "authority_class": {"type": "string", "minLength": 1},
          "summary": {"type": "string", "minLength": 1},
          "source_ref": {"type": "string", "minLength": 1},
          "credential_valid": {"type": "boolean"},
          "policy_allows_action": {"type": "boolean"},
          "control_rationale": {"type": "string", "minLength": 1},
          "state_rationale": {"type": "string", "minLength": 1},
          "depends_on": {
            "type": "array",
            "items": {"type": "string", "minLength": 1},
            "uniqueItems": true
          },
          "state": {
            "type": "object",
            "additionalProperties": false,
            "required": [
              "state_id", "issued_at_s", "not_before_s", "expires_at_s",
              "charge", "threshold", "history_count", "minimum_history",
              "authentic", "veto_clear", "envelope_allows", "decay_rate",
              "maximum_charge"
            ],
            "properties": {
              "state_id": {"type": "string", "minLength": 1},
              "issued_at_s": {"type": "integer", "minimum": 0},
              "not_before_s": {"type": "integer", "minimum": 0},
              "expires_at_s": {"type": "integer", "minimum": 1},
              "charge": {"type": "string", "pattern": "^-?[0-9]+(\\.[0-9]+)?$"},
              "threshold": {"type": "string", "pattern": "^-?[0-9]+(\\.[0-9]+)?$"},
              "history_count": {"type": "integer", "minimum": 0},
              "minimum_history": {"type": "integer", "minimum": 0},
              "authentic": {"type": "boolean"},
              "veto_clear": {"type": "boolean"},
              "envelope_allows": {"type": "boolean"},
              "decay_rate": {"type": "string", "pattern": "^-?[0-9]+(\\.[0-9]+)?$"},
              "maximum_charge": {"type": "string", "pattern": "^-?[0-9]+(\\.[0-9]+)?$"}
            }
          },
          "modeled_context": {
            "type": "object",
            "additionalProperties": false,
            "required": ["divergence", "coupled_loss", "fresh", "rationale"],
            "properties": {
              "divergence": {"type": "string", "pattern": "^-?[0-9]+(\\.[0-9]+)?$"},
              "coupled_loss": {"type": "string", "pattern": "^-?[0-9]+(\\.[0-9]+)?$"},
              "fresh": {"type": "boolean"},
              "rationale": {"type": "string", "minLength": 1}
            }
          }
        }
      }
    }
  }
}
